{"$schema":"https://json-schema.org/draft/2020-12/schema","$id":"https://grandchallenge.ai/schemas/openai_ten_proofs_sphere_packing_route_proposal.schema.json","title":"OpenAI Ten Proofs Sphere Packing Route Proposal","type":"object","additionalProperties":false,"required":["schema_version","record_type","proposal_id","candidate_id","result_family","requested_route_id","proposal_state","tracker_issue","authority","target_scope","evidence_disposition","route_controls","activation","candidate_disposition","claim_boundary"],"properties":{"schema_version":{"const":"1.0.0"},"record_type":{"const":"openai_ten_proofs_sphere_packing_route_proposal"},"proposal_id":{"const":"MC-OTP-ROUTE-PROPOSAL-A-SPHERE-PACKING"},"candidate_id":{"const":"OPENAI-TEN-PROOFS-001"},"result_family":{"const":"OTP-A-SPHERE-PACKING"},"requested_route_id":{"const":"MC-ROUTE-OTP-A-SPHERE-PACKING"},"proposal_state":{"const":"proposed_only"},"tracker_issue":{"const":"https://github.com/grandchallenge/MATHCERT/issues/156"},"authority":{"type":"object","additionalProperties":false,"required":["official_subject","source_pdf","forge_composite_semantic","forge_bridge_semantic","solve_handoff","cert_intake","cert_work_package","cert_replay_evidence","global_registered_route_registry_blob"],"properties":{"official_subject":{"type":"object","additionalProperties":false,"required":["repository","commit","tree"],"properties":{"repository":{"const":"openai/ten-proofs"},"commit":{"$ref":"#/$defs/sha40"},"tree":{"$ref":"#/$defs/sha40"}}},"source_pdf":{"type":"object","additionalProperties":false,"required":["revision","sha256","byte_length"],"properties":{"revision":{"const":"2026-08-06"},"sha256":{"$ref":"#/$defs/sha64"},"byte_length":{"const":2487031}}},"forge_composite_semantic":{"$ref":"#/$defs/mergeBlob"},"forge_bridge_semantic":{"$ref":"#/$defs/mergeBlob"},"solve_handoff":{"type":"object","additionalProperties":false,"required":["merge","producer_packet_blob"],"properties":{"merge":{"$ref":"#/$defs/sha40"},"producer_packet_blob":{"$ref":"#/$defs/sha40"}}},"cert_intake":{"$ref":"#/$defs/mergeRecord"},"cert_work_package":{"$ref":"#/$defs/mergeRecord"},"cert_replay_evidence":{"type":"object","additionalProperties":false,"required":["merge","admitted_head","record_blob","evidence_id","bundle_sha256","final_replay_run","final_replay_job"],"properties":{"merge":{"$ref":"#/$defs/sha40"},"admitted_head":{"$ref":"#/$defs/sha40"},"record_blob":{"$ref":"#/$defs/sha40"},"evidence_id":{"const":"MC-OTP-A-SPHERE-PACKING-REPLAY-EVIDENCE-001"},"bundle_sha256":{"$ref":"#/$defs/sha64"},"final_replay_run":{"type":"integer","minimum":1},"final_replay_job":{"type":"integer","minimum":1}}},"global_registered_route_registry_blob":{"$ref":"#/$defs/sha40"}}},"target_scope":{"type":"object","additionalProperties":false,"required":["lean_theorems","classifications","mandatory_qualifications","nonvacuity_state","nonvacuity_evidence","permitted_axioms","scope_exclusions"],"properties":{"lean_theorems":{"type":"array","minItems":4,"maxItems":4,"uniqueItems":true,"items":{"type":"string","minLength":10}},"classifications":{"type":"array","minItems":4,"maxItems":4,"items":{"type":"string","minLength":10}},"mandatory_qualifications":{"type":"array","minItems":5,"items":{"type":"string","minLength":20}},"nonvacuity_state":{"const":"clear_for_current_root_four_target_surface"},"nonvacuity_evidence":{"type":"array","minItems":5,"items":{"type":"string","minLength":5}},"permitted_axioms":{"type":"array","minItems":3,"maxItems":3,"uniqueItems":true,"items":{"enum":["propext","Quot.sound","Classical.choice"]}},"scope_exclusions":{"type":"array","minItems":6,"items":{"type":"string","minLength":20}}}},"evidence_disposition":{"type":"object","additionalProperties":false,"required":["source_identity","solution_build","challenge_boundary","nonvacuity","comparator","lean_kernel","nanoda","theorem_axiom_report","trust_boundary_scan","semantic_concordance","aggregate_all_dependency"],"properties":{"source_identity":{"const":"clear"},"solution_build":{"const":"pass"},"challenge_boundary":{"const":"four_expected_comparator_sorries_only"},"nonvacuity":{"const":"clear"},"comparator":{"const":"accept"},"lean_kernel":{"const":"accept"},"nanoda":{"const":"accept"},"theorem_axiom_report":{"const":"permitted_only"},"trust_boundary_scan":{"const":"clear"},"semantic_concordance":{"const":"protected_predecessors_reconfirmed"},"aggregate_all_dependency":{"const":"absent"}}},"route_controls":{"type":"object","additionalProperties":false,"required":["global_registered_route_registry_modified","route_registry_entry","may_register_route","may_adjudicate","adjudication","cert_output","mathematical_target_proved","may_promote_claim","aggregate_route","aggregate_adjudication"],"properties":{"global_registered_route_registry_modified":{"const":false},"route_registry_entry":{"type":"null"},"may_register_route":{"const":false},"may_adjudicate":{"const":false},"adjudication":{"type":"null"},"cert_output":{"type":"null"},"mathematical_target_proved":{"const":false},"may_promote_claim":{"const":false},"aggregate_route":{"const":false},"aggregate_adjudication":{"const":false}}},"activation":{"type":"object","additionalProperties":false,"required":["condition","head_change_requires_reapproval","effect"],"properties":{"condition":{"type":"string","minLength":80},"head_change_requires_reapproval":{"const":true},"effect":{"const":"sphere_packing_route_proposal_admitted_no_registration_no_adjudication"}}},"candidate_disposition":{"const":"A_CERT_ROUTE_PROPOSAL_CLEAR__REGISTRATION_NOT_YET_AUTHORIZED"},"claim_boundary":{"type":"string","minLength":300}},"$defs":{"sha40":{"type":"string","pattern":"^[0-9a-f]{40}$"},"sha64":{"type":"string","pattern":"^[0-9a-f]{64}$"},"mergeBlob":{"type":"object","additionalProperties":false,"required":["merge","record_blob"],"properties":{"merge":{"$ref":"#/$defs/sha40"},"record_blob":{"$ref":"#/$defs/sha40"}}},"mergeRecord":{"type":"object","additionalProperties":false,"required":["merge","record_blob"],"properties":{"merge":{"$ref":"#/$defs/sha40"},"record_blob":{"$ref":"#/$defs/sha40"}}}}}
