{
  "schema_version": "1.0.0",
  "record_type": "openai_ten_proofs_sphere_packing_route_proposal",
  "proposal_id": "MC-OTP-ROUTE-PROPOSAL-A-SPHERE-PACKING",
  "candidate_id": "OPENAI-TEN-PROOFS-001",
  "result_family": "OTP-A-SPHERE-PACKING",
  "requested_route_id": "MC-ROUTE-OTP-A-SPHERE-PACKING",
  "proposal_state": "proposed_only",
  "tracker_issue": "https://github.com/grandchallenge/MATHCERT/issues/156",
  "authority": {
    "official_subject": {
      "repository": "openai/ten-proofs",
      "commit": "94bc0feb6a9ff12c7d31d6de640a725c9d43d2b6",
      "tree": "174289e4d4958cb0509874e6e53400e098213de7"
    },
    "source_pdf": {
      "revision": "2026-08-06",
      "sha256": "ebc561ab5c53dbd240e17a8fdb6fffeb648591eca85dbfc7466f563638f8c566",
      "byte_length": 2487031
    },
    "forge_composite_semantic": {
      "merge": "706d0291370bf3f14aa37be0823e33d06f7343b0",
      "record_blob": "b2e309ad96e750651fc7149a6bad54c6bf99015b"
    },
    "forge_bridge_semantic": {
      "merge": "5a0cb9a7b7eef210dd0fce5c527d09b6eef3bc12",
      "record_blob": "7858b156fc4490ecc6e3572dcf449d84dcc99f93"
    },
    "solve_handoff": {
      "merge": "c19735edf4c16ac9765bb66c7209bbf11bf1312e",
      "producer_packet_blob": "9e3b46972bf01ac3d24c6a0ae5f522799335ecd1"
    },
    "cert_intake": {
      "merge": "947b3bed0effa79c2472dddc37d6c463f79c3126",
      "record_blob": "294c9f7d6cceb1cdf7ec4c8e73255dd1ba130670"
    },
    "cert_work_package": {
      "merge": "54b883bb5c6ffaf099efd7270df3519a45b13038",
      "record_blob": "f0c91d1959035f35843c383920dfba0b6c24b485"
    },
    "cert_replay_evidence": {
      "merge": "036646952651057deadc5c485ef9e80a086865cd",
      "admitted_head": "62bcc5b4d2986a39e437d03fd2a52244fcf3b84f",
      "record_blob": "5a2d17d158ee9e8b535de8ed0a1ed41612c5abd2",
      "evidence_id": "MC-OTP-A-SPHERE-PACKING-REPLAY-EVIDENCE-001",
      "bundle_sha256": "0ec443cd35cee041d5bdc154de2e5d1697a21cdffbcc01d21c08c6aad61f10f3",
      "final_replay_run": 32122158005,
      "final_replay_job": 95664825653
    },
    "global_registered_route_registry_blob": "2d17473b4731aa9d9c630b1e7777ad4bd794d993"
  },
  "target_scope": {
    "lean_theorems": [
      "PackingBounds.FullMain.exact_limit",
      "PackingBounds.FullMain.exact_binary_exponent",
      "PackingBounds.PackingBridge.sphere_packing_sharp_asymptotic_upper",
      "PackingBounds.sharpFullCohnElkiesManuscriptConclusions"
    ],
    "classifications": [
      "direct_source_theorem_projection_modulo_proved_full_radial_equivalence",
      "derived_base_two_logarithmic_consequence",
      "source_faithful_displayed_consequence_with_proved_scale_normalization",
      "source_faithful_derived_composite_certificate"
    ],
    "mandatory_qualifications": [
      "The ten-field composite is not a single verbatim manuscript theorem.",
      "The 30-decimal base-two exponent enclosure is a formal numerical consequence of the exact alpha_* expression, not manuscript-authored precision.",
      "The packing bridge relies on proved positive rescaling invariance and unit-separation supremum equivalence; declaration-name similarity is not used as authority.",
      "The explicit little-o witness is a normal form of the source asymptotic and is not a stronger rate claim.",
      "No whole-chapter semantic equivalence or independent proof certification is transferred by this proposal."
    ],
    "nonvacuity_state": "clear_for_current_root_four_target_surface",
    "nonvacuity_evidence": [
      "CohnElkies.admissible_nonempty",
      "fullQuotientSet_eq_radial",
      "SpherePacking singleton unit-separated packing witness",
      "SpherePacking.upper_packing_density_le_one",
      "positive-dimensional bridge quantification"
    ],
    "permitted_axioms": ["propext", "Quot.sound", "Classical.choice"],
    "scope_exclusions": [
      "The ten-field composite may not be represented as a single verbatim manuscript theorem.",
      "The 30-decimal base-two exponent enclosure may not be represented as manuscript-authored precision.",
      "SpherePackingConstant may not be treated as definitionally identical to source Delta_d without the protected scale and unit-separation normalization bridge.",
      "The explicit little-o witness may not be represented as a stronger asymptotic-rate claim.",
      "No whole-chapter or full proof-body equivalence is proposed.",
      "No aggregate OpenAI Ten Proofs route or adjudication is proposed."
    ]
  },
  "evidence_disposition": {
    "source_identity": "clear",
    "solution_build": "pass",
    "challenge_boundary": "four_expected_comparator_sorries_only",
    "nonvacuity": "clear",
    "comparator": "accept",
    "lean_kernel": "accept",
    "nanoda": "accept",
    "theorem_axiom_report": "permitted_only",
    "trust_boundary_scan": "clear",
    "semantic_concordance": "protected_predecessors_reconfirmed",
    "aggregate_all_dependency": "absent"
  },
  "route_controls": {
    "global_registered_route_registry_modified": false,
    "route_registry_entry": null,
    "may_register_route": false,
    "may_adjudicate": false,
    "adjudication": null,
    "cert_output": null,
    "mathematical_target_proved": false,
    "may_promote_claim": false,
    "aggregate_route": false,
    "aggregate_adjudication": false
  },
  "activation": {
    "condition": "exact-head Cert checks, GCL policy/security, protected CodeQL/no-new-alert precedent, fresh non-author sphere-packing/Lean specialist APPROVED review, explicit exact-head Human Steward disposition, ordinary expected-head merge, and protected-main readback",
    "head_change_requires_reapproval": true,
    "effect": "sphere_packing_route_proposal_admitted_no_registration_no_adjudication"
  },
  "candidate_disposition": "A_CERT_ROUTE_PROPOSAL_CLEAR__REGISTRATION_NOT_YET_AUTHORIZED",
  "claim_boundary": "This record proposes only MC-ROUTE-OTP-A-SPHERE-PACKING for exactly the four protected OTP-A-SPHERE-PACKING targets. It does not modify the registered-route registry, register the route, authorize or execute adjudication, issue a Cert output, mark or promote a mathematical target proved, represent the ten-field composite as one verbatim manuscript theorem, attribute the 30-decimal exponent enclosure to the source, erase the proved scale/unit-separation normalization boundary, establish whole-chapter or proof-body equivalence, alter another result family, create aggregate OpenAI Ten Proofs authority, or authorize mathematical truth, novelty, priority, publication, patentability, product, or commercial claims."
}
